{"correlation_id":"battlestar:1167583760:1","created_at":"2026-07-29 10:44:52Z","gzg":"galaxy-message","id":"xcommand:1167583760:1785321892146","payload":{"extraction":{"extraction_id":"xcommand:1167583760:1785321892146","gains":{"capital":301,"loot":[],"neural":25},"generator_version":1,"note":"evac","outcome":"SUCCESS","payload_contract_version":"1.0","replay":{"actions":[{"accepted":true,"action":"select","active_team":0,"actor":{"name":"AUTOPILOT","team":0,"unit_id":1},"ap_after_dispatch":10,"ap_before":10,"record_type":"action","round":1,"sequence":2,"target":{"x":-999,"y":-999,"z":-1},"use_offhand":false},{"accepted":true,"action":"move","active_team":0,"actor":{"name":"AUTOPILOT","team":0,"unit_id":1},"ap_after_dispatch":10,"ap_before":10,"record_type":"action","round":1,"sequence":4,"target":{"x":3,"y":0,"z":-1},"use_offhand":false},{"accepted":true,"action":"brace","active_team":0,"actor":{"name":"AUTOPILOT","team":0,"unit_id":1},"ap_after_dispatch":5,"ap_before":7,"record_type":"action","round":1,"sequence":7,"target":{"x":-999,"y":-999,"z":-1},"use_offhand":false},{"accepted":true,"action":"melee","active_team":0,"actor":{"name":"AUTOPILOT","team":0,"unit_id":1},"ap_after_dispatch":1,"ap_before":5,"record_type":"action","round":1,"sequence":9,"target":{"x":3,"y":1,"z":-1},"use_offhand":false},{"accepted":true,"action":"endturn","active_team":0,"actor":{"name":"AUTOPILOT","team":0,"unit_id":1},"ap_after_dispatch":1,"ap_before":1,"record_type":"action","round":1,"sequence":12,"target":{"x":-999,"y":-999,"z":-1},"use_offhand":false}],"events":[{"event":"tutorial_step_changed","payload":{"complete":false,"display_step":1,"step":"select_commander","total_steps":6},"record_type":"event","sequence":1},{"event":"tutorial_step_changed","payload":{"complete":false,"display_step":2,"step":"move","total_steps":6},"record_type":"event","sequence":3},{"event":"movement_resolved","payload":{"actor":1,"ap_spent":3,"from":{"x":1,"y":1,"z":0},"mode":"run","to":{"x":3,"y":0,"z":0}},"record_type":"event","sequence":5},{"event":"tutorial_step_changed","payload":{"complete":false,"display_step":3,"step":"defense","total_steps":6},"record_type":"event","sequence":6},{"event":"tutorial_step_changed","payload":{"complete":false,"display_step":4,"step":"attack","total_steps":6},"record_type":"event","sequence":8},{"event":"tutorial_step_changed","payload":{"complete":false,"display_step":5,"step":"end_turn","total_steps":6},"record_type":"event","sequence":10},{"event":"damage_resolved","payload":{"attacker":1,"damage":1,"hp_after":9,"hp_before":10,"ranged":false,"target":4,"weapon":"fist"},"record_type":"event","sequence":11},{"event":"tutorial_step_changed","payload":{"complete":false,"display_step":5,"step":"observe_phases","total_steps":6},"record_type":"event","sequence":13},{"event":"agent_decision","payload":{"actor":2,"ap_before":10,"decision":"melee","position":{"x":2,"y":1,"z":0},"rationale":"adjacent hostile","round":1,"score":87.714,"team":0},"record_type":"event","sequence":14},{"event":"damage_resolved","payload":{"attacker":2,"damage":1,"hp_after":8,"hp_before":9,"ranged":false,"target":4,"weapon":""},"record_type":"event","sequence":15},{"event":"agent_decision","payload":{"actor":2,"ap_before":6,"decision":"melee","position":{"x":2,"y":1,"z":0},"rationale":"adjacent hostile","round":1,"score":86.75,"team":0},"record_type":"event","sequence":16},{"event":"damage_resolved","payload":{"attacker":2,"damage":2,"hp_after":6,"hp_before":8,"ranged":false,"target":4,"weapon":""},"record_type":"event","sequence":17},{"event":"agent_decision","payload":{"actor":2,"ap_before":2,"decision":"approach","position":{"x":2,"y":1,"z":0},"rationale":"highest deterministic legal utility","round":1,"score":59.36,"team":0},"record_type":"event","sequence":18},{"event":"agent_decision","payload":{"actor":2,"ap_before":1,"decision":"approach","position":{"x":2,"y":2,"z":0},"rationale":"highest deterministic legal utility","round":1,"score":58.514,"team":0},"record_type":"event","sequence":19},{"event":"agent_decision","payload":{"actor":3,"ap_before":10,"decision":"approach","position":{"x":1,"y":2,"z":0},"rationale":"highest deterministic legal utility","round":1,"score":59.041,"team":0},"record_type":"event","sequence":20},{"event":"agent_decision","payload":{"actor":3,"ap_before":9,"decision":"approach","position":{"x":0,"y":2,"z":0},"rationale":"highest deterministic legal utility","round":1,"score":58.36,"team":0},"record_type":"event","sequence":21},{"event":"agent_decision","payload":{"actor":3,"ap_before":8,"decision":"grab","position":{"x":0,"y":3,"z":0},"rationale":"recover weapon at current position","round":1,"score":70.055,"team":0},"record_type":"event","sequence":22},{"event":"loot_collected","payload":{"actor":3,"ap_spent":1,"cell":{"x":0,"y":3,"z":0},"items":{"spear":1}},"record_type":"event","sequence":23},{"event":"agent_decision","payload":{"actor":3,"ap_before":7,"decision":"throw_spear","position":{"x":0,"y":3,"z":0},"rationale":"legal ranged attack","round":1,"score":87.655,"team":0},"record_type":"event","sequence":24},{"event":"damage_resolved","payload":{"attacker":3,"damage":6,"hp_after":0,"hp_before":6,"ranged":false,"target":4,"weapon":"spear"},"record_type":"event","sequence":25},{"event":"unit_killed","payload":{"attacker":3,"cell":{"x":3,"y":1,"z":0},"target":4,"weapon":"spear"},"record_type":"event","sequence":26},{"event":"agent_decision","payload":{"actor":3,"ap_before":3,"decision":"approach","position":{"x":0,"y":3,"z":0},"rationale":"highest deterministic legal utility","round":1,"score":59.23,"team":0},"record_type":"event","sequence":27},{"event":"agent_decision","payload":{"actor":3,"ap_before":2,"decision":"approach","position":{"x":1,"y":3,"z":0},"rationale":"highest deterministic legal utility","round":1,"score":60.415,"team":0},"record_type":"event","sequence":28},{"event":"agent_decision","payload":{"actor":3,"ap_before":1,"decision":"approach","position":{"x":1,"y":2,"z":0},"rationale":"highest deterministic legal utility","round":1,"score":60.02,"team":0},"record_type":"event","sequence":29},{"event":"turn_started","payload":{"active_team":1,"round":1},"record_type":"event","sequence":30},{"event":"turn_started","payload":{"active_team":2,"round":1},"record_type":"event","sequence":31},{"event":"turn_started","payload":{"active_team":0,"round":2},"record_type":"event","sequence":32},{"event":"tutorial_step_changed","payload":{"complete":false,"display_step":6,"step":"extract","total_steps":6},"record_type":"event","sequence":33},{"event":"mission_resolved","payload":{"note":"evac","outcome":"SUCCESS","survivors":3},"record_type":"event","sequence":34},{"event":"tutorial_step_changed","payload":{"complete":true,"display_step":6,"step":"complete","total_steps":6},"record_type":"event","sequence":35}],"generator_version":1,"mission_seed":1167583760,"rules_version":"alpha-1"},"rules_version":"alpha-1","sector":"Proving Ground","seed":1167583760,"survivors":3,"ts":1785321892146,"type":"extraction"},"schema":"gzg.xcommand.extraction/1.0"},"source":{"galaxy":"xCommand","instance":"godot-web","version":"0.1.1-prealpha.1"},"target":{"capability":"strategic.receive-extraction","galaxy":"BattleStarSol"},"type":"xcommand.extraction","version":"1.0"}